Publication_date,Source,Scraped_category,Title,Summary,Article_Url
11-09-2024,SkyNews,Politics,'Most generous voluntary redundancy package ever' offered to staff at Britain's biggest steelworks,"An annual payment of Â£27,000 will be given to thousands of workers being made redundant at Britain's biggest steelworks under the government intervention to reduce the fallout from closure.As many as 2,800 jobs are to be lost despite the previous government issuing Â£500m of funding. In return, the company would invest Â£750m.The coal-powered furnace currently used to produce steel is being closed and an electric furnace is being built to replace it. Fewer staff will be needed as a result.The Tata Steel site in Port Talbot is the UK's single biggest source of CO2 emissions and its closure will reduce the UK's overall CO2 emissions by around 1.5%.It is understood most job losses will have happened by Christmas, with the remaining redundancies taking place by March 2025.What is the government and Tata doing?A training programme for laid off staff will be offered and funded by Tata. While on the scheme people will be on full pay for the first month and Â£27,000 annually for 11 following months.Starmer's first testWinter fuel cut vote will test Sir Keir Starmer's authorityMPs to vote on cutting winter fuel payment for pensioners as Business Secretary Jonathan Reynolds says government has 'no choice'Keep up with all the latest news from the UK and around the world by following Sky NewsNo funding beyond the original Â£500m will be advanced by the government and financial penalties will be applied should Tata renege on the agreement and funding can be clawed back, the Department for Business and Trade (DBT) saidThe company committed to retaining 5,000 jobs across its UK business. Five hundred staff will be needed to build the electric furnace.A government streel strategy developed with industry will be published in the new year in an effort to secure the future of the industry in Britain.The 'most generous voluntary redundancy package ever'Minimum redundancy payments of Â£15,000 pro-rota will be offered plus a payment of Â£5,000 will be given to redundant workers.As many as 2,000 staff members expressed interest in voluntary redundancy, the DBT added.Those who choose redundancy will be paid 2.8 weeks' pay per year of service, up to a maximum of 25 years.The package is described by the government as the ""most generous voluntary redundancy package ever for a restructure of this size"".West of England and Wales correspondentSteelworker Cassius Walker-Hunt, 28, is unsure about his future at the plant and set up a coffee shop in Port Talbot as a back-up.""I set it up because job insecurity was there. It's been difficult not knowing what's happening and rumours and job security, the plant shutting down and a lot of knowledge being lost.""He told Sky News his new venture was going well:""We're a couple of months in - it's been a brilliant turnout...it's been organic with it all people are just turning up. We just got to keep positive and just hope they'll be other opportunities in this closure.""Fifty miles from Port Talbot - Pro Steel Engineering is one of 50 companies taking on workers like Steve Riddoch, who'd worked as a contractor for Tata for the last 10 years.""I just went out and got in contact with people I'd worked with before or find out where the work was. A lot of the skilled workers hard to match the money they were earning down there.""He said on top of the job losses, the hit to those working in the supply chain will be far bigger:""Down to your local cafes and people supplying food - even the newsagents when they get so many of those workers in every day. I think the bigger picture will hit a lot harder than what people think you know.""Pro Steel Engineering's managing director, Richard Selby, says keeping a skilled workforce in South Wales is vital:""It's vastly important that within Wales we maintain this high skilled manufacturing base. There's a huge capability here at the moment and if we're not careful we'll lose it"".ReactionThe announcement has been welcomed by unions as Unite's general secretary Sharon Graham said the move was ""vital for local communities and the long-term future of the steel industry"".""Make no mistake Unite will be holding Tata's to account to ensure new investment, new lines and new jobs are fully developed,"" she said.""Unite has secured work for nearly all its members, avoiding compulsory redundancies and is in talks with government and Tata to create new jobs,"" she added.Please use Chrome browser for a more accessible video playerA 'tragic missed opportunity'Not all union response was as positive.Be the first to get Breaking NewsInstall the Sky News app for freeA statement from the Community and GMB trade unions said the deal is ""not something to celebrate"".""But - with the improvements the unions and the government have negotiated - it is better than the devastating plan announced by Tata and the Tories back in September 2023,"" a statement read.""Clearly this is not where we wanted to be, and we know that a better plan was available.""It added: ""Back in November last year, Community and GMB published the multi-union plan, an alternative approach that would have safeguarded Port Talbot steelmaking and secured a just transition for the workforce.""Regretfully we couldn't secure the support of all stakeholders for our credible alternative decarbonisation strategy, and ultimately the company rejected the basis of our proposals, representing a tragic missed opportunity.""",https://news.sky.com/story/rachel-reeves-defends-500m-subsidy-for-steel-job-losses-13212770
11-09-2024,SkyNews,Politics,"British Army 'constrained' in ability to train troops over Ukrainian soldier operations, report says","Support for Ukrainian soldiers ""constrains"" the British Army's ability to train its own troops, the National Audit Office (NAO) has said.An investigation by the NAO into the UK's military support of Ukraine found a quarter of the Army's training estate was being used for a basic infantry training programme for Ukrainian recruits - known as Operation Interflex.The parliamentary body said that, as a result of the operation, British Army units bidding for training areas were rejected eight times more often last year than in 2019.They said in their report: ""The MoD has acknowledged that Interflex will constrain the British Army's capacity to train its own soldiers.""Operation Interforge - another training programme for Ukrainian marines - also had to be moved to the Netherlands this year because ""the use of training facilities in the UK was threatening to compromise the Royal Marines' own training needs"".The NAO also noted some Ukranians have criticised Operation Interflex over a lack of training on countering and using drones because of UK military and civil aviation restrictions.A Ministry of Defence (MoD) spokesperson said: ""All UK forces have access to the relevant training required to be held at readiness to protect the UK and meet our NATO commitments.""But we welcome the NAO's report, which recognises that Ukrainian troops are better prepared to defend their country from Russia's illegal invasion thanks to the UK providing training.""Read more:MI6 and CIA warn of Russia sabotage campaignChinese warships travel through UK watersBe the first to get Breaking NewsInstall the Sky News app for freeThe MoD said more than 45,000 Ukrainians have received training in the UK since Russia's full-scale invasion began in February 2022.They added 89% of the most recent wave of Ukrainian forces told the MoD that British training left them better prepared for the battlefield.Gareth Davies, the head of the NAO, said: ""As the Ministry of Defence plans its future support for Ukraine, it must continue to balance the UK's strategic interests with maintaining the UK's own military capabilities.""This includes making sure there are appropriate stocks of equipment and sufficient training provision for UK forces.""Since February 2022, the UK has donated Â£171.5m of equipment from its own stockpile to Ukraine. It has also spent Â£2.4bn procuring new equipment for Kyiv.The MoD told the NAO the cost of replenishing British stockpiles is set to vastly outweigh the value of the donated equipment, and said it expects to spend Â£2.71bn up to 2030-31.Read more on Sky News:TV star calls for apology from PMMultiple bodies found on Mont BlancKeep up with all the latest news from the UK and around the world by following Sky NewsIn the report, the MoD said the discrepancy was because the UK is buying newer equipment which in some cases was more advanced than the kit donated to Ukraine.It comes after Defence Secretary John Healey announced last week Operation Interflex would continue throughout the next year.The minister met his European counterparts and Ukrainian President Volodymyr Zelenskyy at a defence summit in Germany last week.The NAO investigation did not seek to evaluate the strategic case for supporting Ukraine or reach conclusions on value for money, but was intended only to set out the facts regarding what support was being provided.",https://news.sky.com/story/british-army-constrained-in-ability-to-train-troops-over-ukrainian-soldier-operations-report-says-13212687
10-09-2024,SkyNews,Politics,"Voter ID rules 'discouraged' some people from voting in general election, watchdog finds","The requirement to bring photo identification to vote in the general election ""discouraged some people"" from casting their ballot, a watchdog has said.The rule came into force in 2023 after Boris Johnson's Conservative government introduced the new law to parliament.But the first time the impact was tested at a general election came in July this year.Follow latest:Politics news liveWhile the Electoral Commission said ""almost everyone"" was able to take part ""successfully"", around 16,000 people could not vote because of the ID requirement and others were put off from voting entirely.Research carried out by the watchdog showed 0.25% of the public were turned away initially due to not having the right documents, with two-thirds of them later returning with the correct ID - but 0.08% were unable to do so.Its polling also showed 4% of those who chose not to vote said the law was part of their reason for not participating - with those from poorer backgrounds most likely to cite not having accepted ID.Please use Chrome browser for a more accessible video playerThe commission's chief executive Vijay Rangarajan said: ""This was the first time all voters across the UK were required to show photographic ID at a general election, and the data shows almost everyone was able to do so successfully.""However, our research shows that the need for ID discouraged some people from voting - and we don't want to see any voters lose their say.""Public awareness of the need for voter ID is high across the UK, but there are still groups of voters that are less likely to be aware of the need to show ID or that do not have an accepted form.""Everyone eligible should have the opportunity to vote, which is why we are recommending changes that will support those who do not currently have ID and improve the accessibility of elections, while maintaining the security of the process.""Keep up with all the latest news from the UK and around the world by following Sky NewsAmong the recommendations suggested by the watchdog was a review of the list of accepted IDs, calling for it to include student Oyster cards and the Veteran card, as well as a review of the free voter authority certificate to see if issuing it digitally could increase take up.The commission said it would review how its own public campaigns could offer more help to ""minimise the barriers to voting"".Labour voted against the law when it was brought into force by the Tories.However, it has not committed to revoking it, pledging in its manifesto to instead ""address the inconsistencies in voter ID rules that prevent legitimate voters from voting"".Read more from Sky News:Starmer under pressure on two issuesGovernment 'picking pockets of pensioners'Be the first to get Breaking NewsInstall the Sky News app for freeA spokesperson from the Ministry of Housing, Communities and Local Government said: ""The government is committed to strengthening our democracy and making sure every legitimate voter can exercise their democratic right to vote.""The government will carefully consider the report as part of our thorough evaluation of voter ID rules, to understand how they impacted voters, before bringing forward proposals in due course.""A Conservative Party spokesperson also defended the law, saying: ""Voter identification has been tried and tested in Northern Ireland since it was introduced by the last Labour government.""In last year's local elections in England, 99.75% cast their vote successfully, and these new figures for the general election in Great Britain show that 99.92% did so too.""One would expect these figures to rise further as the practice is embedded, and public awareness increases yet further.""",https://news.sky.com/story/voter-id-rules-discouraged-some-people-from-voting-in-general-election-watchdog-finds-13212004
10-09-2024,SkyNews,Politics,MPs to vote on cutting winter fuel payment for pensioners as Business Secretary Jonathan Reynolds says government has 'no choice',"The government has ""no choice"" but to cut winter fuel payments for the majority of pensioners, a minister has said ahead of MPs voting on the controversial plan.The move - which will see around 10 million people lose the payment of up to Â£300 to help with energy costs - has been defended by Labour, who said ""tough decisions"" need to be made in light of the Â£22bn ""black hole"" in public finances.Business secretary Jonathan Reynolds told Sky News: ""We have no choice... We're fixing the foundations [of the economy], and that's a difficult message today.""But it's not just to correct the problem, it's to make sure your house is better in future and the better future we want, more prosperity for everyone, comes through stability and responsibility.""However, some MPs from Labour's own side, as well as charities and opposition MPs, are calling for a U-turn, saying the policy will leave less well-off pensioners with ""a heart-breaking choice between heating and eating this winter"".Keep up with all the latest news from the UK and around the world by following Sky NewsAhead of the vote, Prime Minister Sir Keir Starmer will deliver a speech to the Trades Union Congress (TUC) conference in Brighton, where many in the audience will be in vocal opposition to the policy.He will attack the previous Conservative government for having ""salted the earth of Britain's future to serve themselves"", but appeal for partnership with the unions to fix it, telling them: ""The crisis we have inherited means we must go deep into the marrow of our institutions, rewrite the rules of our economy and fix the foundations so we can build a new home.""Winter fuel backlash and union heat shows Starmer's honeymoon is well and truly overCarol Vorderman calls for apology from Sir Keir Starmer over winter fuel cutWinter fuel cut vote will test Sir Keir Starmer's authoritySir Keir will add: ""Economic rules written in the ink of partnership will be more durable and long-lasting - whoever is in power. So it is time to turn the page, business and unions, the private and public sector, united by a common cause to rebuild our public services and grow our economy in a new way.""We will keep to the course of change, reject the snake oil of easy answers, fix the foundations of our economy and build a new Britain. More secure, more prosperous, more dynamic, and fairer. A country renewed and returned, calmly but with confidence, to the service of working people.""The prime minister has stood by the move since it was announced, insisting additional ""safeguards"" are in place for pensioners already on benefits.He added: ""I am determined that we will take tough decisions because the change which is improved living standards, people feeling better off, better public services, dealing with crime and immigration and issues like that, that change will only happen if we fix the foundations now.""Further potentially unpopular measures, including possible tax rises, are expected next month when Ms Reeves delivers her first Budget.Please use Chrome browser for a more accessible video playerBut Sky News understands as many as 30 Labour MPs are unhappy with the winter fuel payment cut, though they are likely to abstain on the vote rather than go against the party after Labour suspended seven of its MPs in July after they rebelled over keeping the two-child benefit cap.The general secretary of one of Labour's major union backers, Unite, accused the party of ""picking the pockets of pensioners"".Speaking to Sky News from the TUC conference, Sharon Graham said the country was ""in crisis"" and the new government needed to ""make very, very different choices"" - including introducing a wealth tax ""on the biggest and richest 1% in society"".Please use Chrome browser for a more accessible video playerThe Conservatives are among the opposition parties putting forward their own motions to try and stop the cut - though with Labour's large majority, the government is likely to win the vote.Former prime minister and Tory leader Rishi Sunak reiterated his accusation that Sir Keir was choosing to ""cut vital support for pensioners to fund an inflation-busting pay rise for train drivers"", calling it ""unnecessary and wrong"".Please use Chrome browser for a more accessible video playerAlso speaking ahead of the vote, Liberal Democrat leader Sir Ed Davey said the government ""should do the right thing and change course"" as cutting the winter fuel payment would ""put untold stress on pensioners, with many facing a heart-breaking choice between heating and eating this winter"".He confirmed his party will vote against the cut.Be the first to get Breaking NewsInstall the Sky News app for freeThe SNP's Westminster leader, Stephen Flynn, also urged Scottish MPs on the Labour benches to follow his party's lead and vote down the change in policy, saying: ""The last UK government hammered the economy, public services and household incomes by imposing 14 years of cuts and Brexit.""The last thing the UK needs now is more cuts from the Labour Party - and pensioners will face a bitter winter if these cuts go ahead.""",https://news.sky.com/story/mps-to-vote-on-cutting-winter-fuel-payment-for-pensioners-13211964
09-09-2024,SkyNews,Politics,How worried should Labour be about the Green Party?,The Green Party had its most successful election night ever after winning four seats back in July. But what will it take to seriously challenge Labour?,https://news.sky.com/video/how-worried-should-labour-be-about-the-green-party-13211671
08-09-2024,SkyNews,Politics,Health Secretary Wes Streeting 'not remotely happy' about cutting winter fuel payments,"The health secretary has said he is ""not remotely happy"" about having to vote to cut the winter fuel allowance for some pensioners.",https://news.sky.com/video/health-secretary-wes-streeting-not-remotely-happy-about-cutting-winter-fuel-payments-13211522
08-09-2024,SkyNews,Politics,Unite boss Sharon Graham accuses government of 'picking pockets of pensioners',"Sharon Graham has told Sky News that chancellor Rachel Reeves is guilty of ""picking the pockets of pensioners"" by cutting winter fuel payments.",https://news.sky.com/video/unite-boss-sharon-graham-accuses-government-of-picking-pockets-of-pensioners-13211639
08-09-2024,SkyNews,Politics,Health Secretary Wes Streeting says NHS waiting lists need to be 'millions lower' by 2029,"Wes Streeting told Sky News' Sunday Morning with Trevor Phillips he is willing to do whatever it takes to ensure waiting lists are brought down, including using the private sector.",https://news.sky.com/video/health-secretary-wes-streeting-says-nhs-waiting-lists-need-to-be-millions-lower-by-2029-13211430
07-09-2024,SkyNews,Politics,Keir Starmer makes first official visit to Republic of Ireland as PM,"The prime minister met with his Irish counterpart, Simon Harris, as part of the visit to Dublin.",https://news.sky.com/video/keir-starmer-makes-first-official-visit-to-republic-of-ireland-as-pm-13210975
05-09-2024,SkyNews,Politics,Angela Rayner says 'I take my job really seriously' following criticism over Ibiza dance video,"Sir Keir Starmer's deputy comments on a video showing her having a good time in Ibiza, justifying it by saying: ""Everybody needs down time.""",https://news.sky.com/video/angela-rayner-says-i-take-my-job-really-seriously-following-criticism-over-ibiza-dance-video-13209945
05-09-2024,SkyNews,Politics,Politics Hub: Tony Blair sits down with Sophy Ridge to discuss leadership and the Middle East,The former UK prime minister refused to be drawn on what kind of leader he considered Benjamin Netanyahu to be.,https://news.sky.com/video/politics-hub-tony-blair-sits-down-with-sophy-ridge-to-discuss-leadership-and-the-middle-east-13210208
05-09-2024,SkyNews,Politics,Grenfell: 'Greed and deregulation had been put before safety' says Deputy PM Angela Rayner,The final report into the fire said all of the 72 deaths were avoidable.,https://news.sky.com/video/grenfell-greed-and-deregulation-had-been-put-before-safety-says-deputy-pm-angela-rayner-13209895
10-09-2024,SkyNews,Politics,Starmer's first test,"Sky News' deputy political editor Sam Coates and Politico's Jack Blanchard are back with their daily guide to the day ahead in politics in under 20 minutes.On the day of a big Commons vote on the future of winter fuel payments, Jack and Sam discuss whether this is really the first big test of the new government and how Rachel Reeves and Sir Keir Starmer are dealing with potential rebels.They also talk about the meeting today between the foreign secretary and the US secretary of state Anthony Blinken.And they have an update on the Conservative Party leadership race on the day one more contestant is knocked out.You can now send a WhatsApp to Jack and Sam on 07511 867 633 or email them: jackandsam@sky.ukðŸ‘‰ Tap here to follow Politics at Jack and Sam's wherever you get your podcasts ðŸ‘ˆ",https://news.sky.com/story/starmers-first-test-13212153
