Publication_date,Source,Scraped_category,Title,Summary,Article_Url
13-02-2024,SkyNews,Israel-Hamas War,What is the two-state solution for Israel and Palestinians?,"The two-state solution has long been proposed as the best hope for peace in the Israeli-Palestinian conflict.It would see an independent Palestinian state established alongside the existing one of Israel - giving both peoples their own territory.It is the official position of the UK, US, the United Nations, and until now, Israel.On 18 January in a televised address, Prime Minister Benjamin Netanyahu said: ""In any future arrangement.... Israel needs security control over all territory west of the Jordan River.""It comes after several other Israeli politicians explicitly stated they no longer endorse a two-state solution.Here, we look at some of the key obstacles.What would it look like - and who would live where?The biggest obstacle to a two-state solution is deciding what the borders of a potential Palestinian state would be.Many believe they should be the same ones that existed before the 1967 Six-Day War, which saw Israel occupy East Jerusalem, the West Bank and Gaza.Since then, increasing numbers of Israeli settlements have been established inside the West Bank, with around 600,000 Israelis now living there and in Occupied East Jerusalem.Although these settlements are considered illegal under international law, their existence makes the territory increasingly difficult to designate as Palestinian.Read more:The deep roots of the Israeli-Palestinian conflictCould Hezbollah-Israel clashes lead to a wider war?How did this war happen?The creation of Israel and the subsequent Arab-Israeli war of 1948 saw many Palestinians forced from their homes, in what is known as the Nakba, or ""catastrophe"" in English.As such, the UN gave around 750,000 people refugee status, defined as people ""whose normal place of residence was Palestine during the period 1 June 1946 to 15 May 1948, and who lost both home and means of livelihood as a result of the 1948 conflict"".But under the same criteria, 5.9 million Palestinians - who live in the West Bank, Gaza, East Jerusalem, and in camps across Jordan, Lebanon and Syria - now qualify, and many would want to return to their homeland.There would not be space for this increased number of people inside the occupied territories, meaning some would have to be resettled in Israeli territory, which Israel is unlikely to tolerate.JerusalemThere are particular border difficulties with Jerusalem.Both sides claim the ancient city as their capital. This is because of its huge historical and religious significance for both Israelis and Palestinians and the fact it is home to several holy sites in Judaism, Islam, and Christianity.For example, the walled Old City hosts both The Temple Mount - Judaism's holiest site - and Al Aqsa Mosque, the third most important location in Islam behind Mecca and Medina, where Muslims believe the Prophet Muhammad ascended to heaven.In 2023, there were violent clashes between Israeli police and Palestinian worshippers there.The Israeli government claims Jerusalem is their ""undivided capital"", and it is the seat of the Israeli government and parliament (Knesset), but East Jerusalem is widely considered an occupied Palestinian territory.In theory, a two-state solution would officially recognise both East Jerusalem as the Palestinian capital and a western part of the city for the Israelis.Who supports it - and what has Israel said?Previously, Israel's endorsement was conditional on Palestinian groups demilitarising - as it sees Hamas and others as an existential threat.Fatah and the governing Palestinian Authority in the West Bank support the solution, providing they are allowed to police themselves.Hamas, which controls Gaza, has committed itself to the destruction of Israel. However, in a revised charter published in 2017, it said it would accept a Palestinian state along the 1967 borders.The lack of consensus on the Palestinian side makes the solution difficult - and the admission of Israeli officials that they are no longer committed to it near impossible.The US has recently reiterated the two-state solution is the best way to ensure Israel's security, unify moderate Arab countries in the region, and isolate Iran.It has also called for the Palestinian Authority to be ""revitalised"" and able to return to Gaza having been ousted in 2007.Please use Chrome browser for a more accessible video playerBut Mr Netanyahu said in his recent address that Israel ""will not settle for anything short of absolute victory"" and that Israeli control over all territory west of the Jordan River is a ""necessary condition"" when the current conflict ends.""I tell this truth to our American friends and I also stopped the attempt to impose a reality on us that would harm Israel's security,"" he said.Before now, he has been quoted by Israel's national broadcaster, saying Palestinian hopes of a sovereign state ""must be eliminated"".Previously Israeli communications minister Shlomo Karhi wrote on X: ""There will be no Palestinian state here.""And Israeli-UK ambassador Tzipi Hotovely told Sky News the country does ""absolutely not"" endorse a Palestinian state, adding: ""Israel knows today, and the world should know now that the Palestinians never wanted to have a state next to Israel.""They want to have a state from the river to the sea. They are saying it loud and clear. It's now two months after the war started. The Palestinian Authority didn't condemn this massacre (7 October). It's such a big problem.""Meanwhile, although the UN and international community have widely condemned the expansion of Israeli settlements in the West Bank and consider them a major barrier to peace, little has been done to deter Israel.Israel disagrees and cites historical and biblical ties to the land.It is widely considered to hold a power advantage over the Palestinians, economically and in terms of its military resources.It has benefited from the strong and consistent support of the US, from which it has been the largest cumulative recipient of US foreign aid since the Second World War.But that support has been on the basis that both sides were working towards a two-state solution, with many left wondering if that will now change.When was there more hope?Hope for the two-state solution peaked in the early 1990s, when the US facilitated the signing of the Oslo Accords under the presidency of Bill Clinton.Famously, then Israeli prime minister Yitzhak Rabin and Palestinian Liberation Organisation chairman Yasser Arafat shook hands on the lawn of the White House.The Oslo Accords saw Israel formally acknowledge the PLO as representative of the Palestinians, and in return the group renounced violence.The two sides agreed on the formation of a Palestinian Authority, which would govern the West Bank and Gaza for a five-year period.Mr Rabin was assassinated by a young Jewish nationalist two years later, which many argue saw hopes of the two-state solution diminish.Since then, various factors have further reduced the chances of the two sides agreeing on a peaceful resolution.These include: increased Jewish settlements in the West Bank; Donald Trump's presidency and his relocation of the US embassy from Tel Aviv to Jerusalem; the most right-wing Israeli government in the country's history; and this year's Hamas attack and the ensuing war.",https://news.sky.com/story/israel-hamas-war-what-is-the-two-state-solution-12985473
12-06-2024,SkyNews,Israel-Hamas War,Mother of freed Russian-Israeli hostage feared the worst for son held by Hamas,"Evgeniia Kozlova was at home in St Petersburg last weekend when she got the call from her Israeli liaison officers.""They asked, 'how are things, how are you feeling? Are you alone there? Are you sitting down?'""I dropped the phone to one side, and it fell under the table.""Israel-Hamas war latest: IDF strikes back after Hezbollah fires 160 rocketsHer son, Andrey, had been living in Israel and working as a security guard at the Nova music festival when he was kidnapped by Hamas on October 7th.After eight months of hoping he was still alive but hearing nothing about his condition or whereabouts, Evgeniia feared the worst.""Suddenly I heard from under the table 'it's good news, good news!' and so I crawled under the table.Israeli strikes in Khan Younis tent camp kill at least 19 and injure at least 60, Palestinian officials sayUK and US split over Israel after British government suspends some arms salesUK to suspend some arms sales to Israel, foreign secretary announces""Did you say good news?""'Yes, they are bringing Andrey over by helicopter, he's almost in Israel now!'""They said it three times, and I still couldn't comprehend. Who is bringing whom over, and where?""They said it over and over until I got it. From that moment on I haven't stopped smiling, I haven't stopped laughing!""Mikhail Kozlov, divorced from his wife but on good terms, packed instantly and ran over to join her. They flew to Israel the following day.An emotional video of them being reunited with the son in an Israeli hospital showed Andrey breaking down and hugging his mother's legs.Read more: The hostages rescued by Israel""During the eight months we've been waiting for him we feared he would be changed a lot, that he would be a different man and we would have to help him rehabilitate, help him recover,"" Evgeniia said.Footage released by Israeli counterterrorism police showed the moment they were rescued amid heavy explosions and gunfire.Please use Chrome browser for a more accessible video playerAs well as Andrey, three other hostages were rescued: Noa Argamani, Almog Meir Jan and Shlomi Ziv.Ziv, Jan and Kozlov were held together. Kozlov doesn't speak fluent Hebrew or English and so it was hard for him to communicate with the other two, but they supported each other through their captivity and remain close.""One of the phrases that really scared or hurt us, was when he said, 'there are some things I will never tell you about,' as for everything else, yes, he tells us, but it's as if he's playing storyteller, as if to entertain us,"" Evgeniia added.""Even the fact that his hands and feet were tied for two months - his hands and feet were tied - he tells it as if it were a joke.""At first, their hands were tied behind their backs, and he told us how proud he was that he managed to eat with his hands tied, unaided.""Andrey said that they are kept in very difficult conditions. His guards told him 'your conditions are good compared to the rest, they are kept in much worse conditions'.""The main thought he carried out of there was that all those remaining there must be freed. For a living, normal person it is unbearable to stay there for such a long time, eight months.""These are impossible conditions. Impossible.""Hamas claims at least 274 Gazans were killed during the raid and hundreds injured. Mobile phone footage shows scores of dead and wounded in the crowded Nuseriat market area.Israel says the death toll was below a hundred and blames Hamas for holding the hostages in a busy civilian area, but the United Nations has suggested both sides could be guilty of war crimes.Please use Chrome browser for a more accessible video playerDiplomatic efforts to secure a new ceasefire and hostage deal are progressing unsteadily, despite the presence of US secretary of state Antony Blinken in the region again.Hamas formally responded to President Biden's proposal on Tuesday night but reportedly want amendments that might not be acceptable to Israel.Both sides continue to differ over when a permanent ceasefire should come into force: Hamas insists on it being agreed before any deal is implemented, whilst Israel is sticking firm on its commitment to keep fighting.Read more from Sky News:Israel hit school while 'targeting Hamas'Keep up with all the latest news from the UK and around the world by following Sky NewsTensions have also risen to new levels on Israel's northern border with Lebanon. More than 160 rockets were fired into Israel on Wednesday morning after Israel killed a Hezbollah commander on Tuesday, the most senior killed during the war so far.No casualties were reported, although small fires broke out where some of the rockets landed.",https://news.sky.com/story/mother-of-freed-russian-israeli-hostage-feared-the-worst-for-son-held-by-hamas-13151859
09-06-2024,SkyNews,Israel-Hamas War,Who are the four hostages rescued by Israel?,"Israel has announced it has rescued four hostages from Gaza.The group includes two people who attended the Nova music festival, and two people working there as part of the security.At least one Israeli soldier died in the operation to retrieve the group from Gaza, according to Israel, while Hamas says at least 210 Palestinians were killed during attacks in the area around the rescue.Israel-Gaza latest: Number killed in Gaza operation rises againSo who are the four hostages rescued by Israel?Noa ArgamaniNoa Argamani, 25, is the most well-known of the Israeli hostages rescued in the Nuseirat operation.This is because a video of her being abducted on 7 October was released in the wake of the Hamas attack.It showed her on a motorbike in the desert, surrounded by men.Ms Argamani can be seen calling out to her boyfriend, Avinatan Or, with whom she had been at the Nova music festival with.Mr Or has not been since 7 October.Ms Argamani has Chinese heritage, and there were appeals from her family and the Israeli government to get Beijing involved in her rescue, but it never materialised.According to The Times of Israel, she was a second year student at Ben Gurion University in the southern Israeli city of Be'er Sheva.Please use Chrome browser for a more accessible video playerSince her abduction, it is reported that Ms Argamani's mother has been diagnosed with terminal cancer.Footage of the family's reunification was shared on social media in the wake of the rescue.Read more:Israel rescues four hostagesJets targeting 'Hamas compound' hit Gaza schoolTeenager on how she escaped Gaza after amputationAlmog Meir JanAlmog Meir Jan, 21, was another attendee of the Nova music festival taken captive on 7 October.According to an interview with his mother, he had been set to start a new job in Israel's ""high-tech"" sector on 8 October.Keep up with all the latest news from the UK and around the world by following Sky NewsHe was at the music festival with his friend, who was killed and later burned, according to the Jewish Chronicle.His mother, Orit, says Mr Jan rang her at 7.45am on 7 October to say the festival had been stopped, and he would call her back every hour - and never phoned again.Several hours later, one of his friends is said to have identified Mr Jan in a video clip published by Hamas.In his absence, Mrs Jan has campaigned for his release, including meeting with Prime Minister Benjamin Netanyahu and members of the Knesset.Andrey KozlovAndrey Kozlov, 27, was also at the Nova festival - but he was working as a security guard.According to reports in the Times of Israel, he is a native of St Petersburg in Russia, and had moved to Israel 18 months before the festival.He lived near Tel Aviv with friends before he was taken.After his kidnapping, his mother travelled to Israel to try and secure his release.Shlomi ZivðŸ‘‰ Listen above then tap here to follow the Sky News Daily wherever you get your podcasts ðŸ‘ˆShlomi Ziv, 40, was another member of the security staff captured at the Nova music festival.Speaking to one of his sisters, he said he was heading home from the festival after the Hamas attack began.Be the first to get Breaking NewsInstall the Sky News app for freeHe told her there was a bottleneck of cars, The Times of Israel reported.Mr Ziv had been at the event with a friend and a relative of his wife. Both died. It was several weeks before his family knew he had been taken hostage.",https://news.sky.com/story/who-are-the-four-hostages-rescued-by-israel-13149870
04-09-2024,SkyNews,Israel-Hamas War,"UK's partial arms embargo on Israel is shameful, Benjamin Netanyahu's close aide says","The UK's decision to place a partial arms embargo on Israel was ""shameful"", a close aide to Prime Minister Benjamin Netanyahu has told Sky News, as he insisted his country is not violating international humanitarian law in Gaza.Ron Dermer, Israeli minister of strategic affairs, condemned the UK's suspension of some arms licences to Israel earlier this week, arguing it came just days after six more Israeli hostages were ""executed"" by Hamas.Addressing the Commons on Monday, Foreign Secretary David Lammy said a review of export licences for UK arms found there was a ""clear risk"" British weapons might be used to commit ""a serious violation of international humanitarian law"".Mr Dermer said the decision to halt around 30 of 350 licences was ""shameful"" as Israel is ""on the frontlines fighting against Iran and its axis that are the enemies of civilisation"".Keep up with all the latest news from the UK and around the world by following Sky NewsThe minister also denied Israel is violating international humanitarian law in Gaza, where, according to the enclave's health ministry, more than 40,800 Palestinians have been killed since the war broke out nearly 11 months ago.The war was sparked after Hamas, the militant group ruling the besieged enclave of Gaza, carried out an unprecedented attack on Israel which saw 1,200 people killed on 7 October.More than 250 people were taken hostage.Israeli strikes in Khan Younis tent camp kill at least 19 and injure at least 60, Palestinian officials sayUK and US split over Israel after British government suspends some arms salesHamas releases video of Israeli hostage who IDF says was murderedSpeaking to Sky News' Yalda Hakim, Mr Dermer sought to condemn the partial arms embargo saying: ""You'd ask yourself how the British people would feel if Churchill was leading Britain in its fight against the Nazis and Britain was standing largely alone, if all of a sudden there would be arms embargoes from its great friend and ally.""Please use Chrome browser for a more accessible video playerIt comes as Mr Netanyahu's government faces mounting pressure both at home and internationally to get a ceasefire and hostage release deal done.Hundreds of thousands took to the streets of Israel over the weekend to express anger at six more hostages being killed in captivity in Gaza.Despite the pressure, Mr Dermer said: ""We will not fold,"" as he called for Israel to stand united.""We are going to do everything we can to bring the hostages home but in that process we are not going to endanger the security of 10 million Israelis and enable October 7 to happen again and again and again just like Hamas wants.""Mr Dermer said while Israel was ready to negotiate a permanent ceasefire during a temporary one, Hamas has not been ""prepared to do any deal"".Be the first to get Breaking NewsInstall the Sky News app for freeRead more:Hamas releases video of Israeli hostage who IDF says was murderedNetanyahu's crisis is getting worse - and Israel may never forgive himMr Dermer repeated claims by Mr Netanyahu on Monday of the importance for Israel to retain control of the Philadelphi corridor, which runs along the border between Gaza and Egypt.Please use Chrome browser for a more accessible video playerThe minister claimed the corridor has been a ""supply chain for Hamas' armaments"" and the attack on 7 October, which became the bloodiest day in Israeli history, ""couldn't have happened"" if it had been closed.He also claimed giving up control of the corridor would put Israel at risk of repeated attacks like 7 October.The corridor has been a major sticking point in efforts to secure a deal to halt the fighting in Gaza and return Israeli hostages held by Hamas.But Mr Dermer said the corridor wasn't the only sticking point in negotiations. He didn't elaborate on what other hold-ups are hindering a permanent ceasefire deal.",https://news.sky.com/story/uks-partial-arms-embargo-on-israel-is-shameful-benjamin-netanyahus-close-aide-says-13209580
03-09-2024,SkyNews,Israel-Hamas War,Hamas releases video of Israeli hostage who IDF says was murdered,"Hamas has released a video of one of the six hostages that the Israeli military says was""brutally murdered"".Eden Yerushalmi, 24, was working as a bartender at the Nova music festival on 7 October when she was abducted by the militant group.Almost a year later, she and five other hostages were ""murdered"" a short time before Israeli forces found them in an underground tunnel on Saturday night, according to the Israeli military.The two-minute clip released by Hamas includes Ms Yerushalmi saying she missed her family.It is not clear when the footage was taken or the circumstances of how it was filmed. The video was released on Hamas's social media channels late on Monday night.Her family called the footage a ""shocking psychological terror video"".They gave permission for a 12-second extract of the video to be used, and said: ""Our Eden, we love you too and we miss you like crazy. You are forever in our hearts.""Read more:Who are the six Israeli hostages confirmed dead?UK to halt some arms exports to IsraelKeep up with all the latest news from the UK and around the world by following Sky NewsOn the day she was abducted, Ms Yerushalmi sent a video of rocket fire to her family group chat and said she was leaving the festival, the Hostages and Missing Families Forum said.She then called the police and pleaded with them to ""find me, okay?"", as she relayed details of the unfolding massacre.Be the first to get Breaking NewsInstall the Sky News app for freeFor four hours after, she spoke with her sisters May and Shani, who heard everything she went through as she tried to escape.""Her last words were, 'Shani, they've caught me',"" the forum said.The Israeli Health Ministry said post mortem examinations had determined the hostages had been shot at close range and died on Thursday or Friday.IDF Lt Col Nadav Shoshani said the bodies were discovered several dozen metres underground while ""ongoing combat"" was taking place, but that there was no firefight in the tunnel itself.Israeli Prime Minister Benjamin Netanyahu accused Hamas of killing all six hostages in ""cold blood"" and said Israel would hold the group accountable.He also accused the group of scuttling ongoing ceasefire efforts, adding: ""Whoever murders hostages doesn't want a deal.""Meanwhile, Izzat al-Rishq, a senior Hamas official, blamed the hostages' deaths on Israel and the US, saying they would still be alive if Israel had accepted a ceasefire proposal that Hamas said it had agreed to back in July.He did not mention the hostages by name.Watch Sky News' The World with Yalda Hakim at 9pm.",https://news.sky.com/story/hamas-release-video-of-israeli-hostage-whose-body-was-found-at-weekend-13208919
