Publication_date,Source,Scraped_category,Title,Summary,Article_Url
09-09-2024,SkyNews,US,'No special treatment' for self-proclaimed 'son of god' preacher wanted by FBI after Philippines arrest,"A preacher followed by millions of people around the world will get no special treatment after his arrest in the Philippines, the country's president has said.Apollo Quiboloy, a self-proclaimed ""owner of the universe"" and ""appointed son of god"", is wanted by the FBI in the US on charges of sex trafficking and bulk cash smuggling.The super-church preacher was also wanted in the Philippines before his arrest on Sunday.More than 2,000 police officers were involved in the search for the evangelist before he was caught.He was found hiding after the weeks-long search inside a ""Bible school"" at the sprawling compound in the southern city of Davao owned by his church, the Kingdom of Jesus Christ (KOJC), according to local police.President Ferdinand Marcos Jr said on Monday that Quiboloy, a longtime friend of former president Rodrigo Duterte, would get ""no special treatment"".President Marcos said: ""We will treat him like any other arrested person and respect his rights.""We will demonstrate once again that our judicial system in the Philippines is active, vibrant and working.""Quiboloy also appeared in front of the media on Monday.But despite being known for his long sermons, the 74-year-old televangelist made no comment.Keep up with all the latest news from the UK and around the world by following Sky NewsFormer president Mr Duterte and his family had criticised a massive raid on the preacher's religious complex in Davao on 24 August, which included police equipment that could detect people hiding in underground tunnels.Quiboloy's lawyer, Israelito Torreon, said the pastor surrendered to the police and military because he did not want the situation to further escalate.""The innocence of Quiboloy will be affirmed by the court,"" Mr Torreon told DZBB radio.Benjamin Abalos Jr, the interior minister, said the government was looking to file charges against people who helped Quiboloy evade arrest.Read more on Sky News:X Factor finalist dies aged 42, former band saysElon Musk 'on track to be the first trillionaire by 2027'Be the first to get Breaking NewsInstall the Sky News app for freePresident Marcos said Quiboloy's camp had set conditions for his surrender, including a guarantee he would not be sent to the US to face charges.""Putting conditions is not an option for someone who is a fugitive,"" the president said, describing the operation to capture Quiboloy as ""police work at its best"".""It is with some relief that I can say that this phase of the operation is over. We will now leave Quiboloy to the judicial system,"" he said.The Philippines' Department of Justice acknowledged the country's extradition treaty with the US but said Quiboloy will first face trial and serve any sentence in the Philippines before any extradition request is granted.",https://news.sky.com/story/no-special-treatment-for-self-proclaimed-son-of-god-preacher-wanted-by-fbi-after-philippines-arrest-13212083
10-09-2024,SkyNews,US,Apple launches new iPhone and AI at its biggest event of the year - but will it be enough to make you part with your cash?,"Apple launched its latest iPhone on Monday night in its biggest release of the year.As well as the iPhone 16 coming in a new range of colours and having a new camera button, it is also capable of running Apple Intelligence, the company's new AI, making it the first artificially intelligent smartphone it has made.Over the next few months, Apple Intelligence will be embedded throughout the phone and other Apple devices, changing the way users edit photos, respond to messages and ask questions.But will the new technology be enough to make cash-strapped consumers choose the iPhone 16?What is the iPhone 16's 'killer app'?Which? tech expert Andrew Laughlin says it's a tough job convincing people to buy new smartphones nowadays.According to a recent survey run by the consumer group, two thirds of phone users now keep their devices for over three years.""You really have to work if you want people to be on the premium cycle now,"" he told Sky News.""When it really comes down to it, it's what's that killer app? What's that thing that you get the FOMO [fear of missing out] about?""He describes portrait mode on the previous iPhone Plus as an example of that ""killer app"".""That spurred on upgrades because you looked at other people's portraits and you went, 'Wow, yours look so much better than mine'.""He said people only want AI if it is going to make life easier rather than just for the sake of it.""If it can facilitate us doing the things we want quicker and faster, it will blow up like we think it's going to blow up,"" he said.Apple Intelligence and privacySamsung and Google released their own AIs on their phones earlier this year.""The focus on enhancing AI capabilities to make everyday life easier is typical of Apple's 'wait and see' strategy, where they often decide to take their time with a refined effort, rather than wade in on the latest tech trends,"" said Ernest Doku, mobiles expert at Uswitch.com after the launch.Apple say it is also their focus on privacy which sets Apple Intelligence apart.Although it runs in partnership with ChatGPT - if Apple Intelligence can't answer your request, it'll pass it to ChatGPT - the company says all requests that leave your iPhone will be encrypted and anonymised.Read more:Elon Musk on track to be the first trillionaire by 2027Gaming still has a women problemTroubled Boeing Starliner capsule lands on Earth emptyKeep up with all the latest news from the UK and around the world by following Sky NewsThe event name, It's Glowtime, was also a reference to the company's privacy focus.When Siri or Apple Intelligence is listening to a user, the iPhone's screen will glow around the edges to make the user aware.But even though privacy is important to people, Mr Laughlin isn't convinced it'll be enough to make shoppers choose Apple Intelligence over Gemini, Google's AI or Samsung AI.""Privacy is a driver for people but is it a top driver? No,"" he said.""That's always going to be price, brand and usability.""Be the first to get Breaking NewsInstall the Sky News app for free""Crucially, while these AI features will be central to the iPhone 16 experience, they will only be rolled out to the most expensive models of last year's iPhone, which means if you aren't able to upgrade to the latest and greatest, you may miss out,"" said Mr Doku.As well as the new iPhone 16 and Apple Intelligence capabilities, Apple also launched the next generation of Apple watches and AirPods.",https://news.sky.com/story/apple-to-launch-new-tech-at-its-biggest-event-of-the-year-but-will-it-be-enough-to-make-you-part-with-your-cash-13211883
09-09-2024,SkyNews,US,Selena Gomez says pregnancy and giving birth could risk her life - as she explains why she can't carry children for first time,"Selena Gomez has said she cannot carry her own children due to health issues.The actor and singer told Vanity Fair her chronic health issues, which include a lupus diagnosis, make it risky for her to carry a baby to term and give birth.The 32-year-old was discussing her role in the film Emilia Perez, in which she plays a young mother, and was also asked about her relationship with songwriter Benny Blanco, who said earlier this year he wants to have children in the future.""I haven't ever said this, but I unfortunately can't carry my own children,"" she told Vanity Fair.""I have a lot of medical issues that would put my life and the baby's in jeopardy. That was something I had to grieve for a while.""Discussing becoming a parent one day, she said: ""It's not necessarily the way I envisioned it.""I thought it would happen the way it happens for everyone. [But] I'm in a much better place with that.""I find it a blessing that there are wonderful people willing to do surrogacy or adoption, which are both huge possibilities for me.""It made me really thankful for the other outlets for people who are dying to be moms. I'm one of those people.""Speaking about the next chapter of her life, she said: ""I'm excited for what that journey will look like, but it'll look a little different.""At the end of the day, I don't care. It'll be mine. It'll be my baby.""Read more from Sky News:Jeremy Kyle guest left 'broken' and 'distraught' after show'Grumpy' Noel Gallagher to feature in portrait galleryHollyoaks star diagnosed with breast cancerKeep up with all the latest news from the UK and around the world by following Sky NewsLupus is an incurable immune system illness which is believed to be genetic in origin.The immune system turns against the body and produces too many antibodies, which damage organs and tissues - often irreversibly, meaning many lupus sufferers have transplants.Be the first to get Breaking NewsInstall the Sky News app for freeGomez herself underwent a kidney transplant in 2007.While people with lupus can have successful pregnancies, it increases the risks of complications, including kidney problems, blood clots and high blood pressure.",https://news.sky.com/story/selena-gomez-says-pregnancy-and-giving-birth-could-risk-her-life-as-she-explains-why-she-cant-carry-children-for-first-time-13212041
10-09-2024,SkyNews,US,Harvey Weinstein in intensive care at hospital after emergency heart surgery,"Disgraced Hollywood movie mogul Harvey Weinstein is in intensive care in hospital recovering from emergency heart surgery, his lawyer says.The 72-year-old was taken from Rikers Island prison, where he is serving a sentence for rape, to Bellevue Hospital in New York on Monday.Weinstein underwent pericardiocentesis surgery - a procedure to remove fluid from around the heart and lungs - but he is ""not in critical condition"", according to his representative, Craig Rothfeld.He said Weinstein is recovering in the intensive care unit and ""is in pain from the procedure and still dealing with several other serious health issues which need to be addressed"".Weinstein's lawyer, Arthur Aidala, said they requested that prison officials immediately move him to Bellevue ""based on his complaints to us regarding chest pains"".The former film producer is due in court on 12 September for a retrial hearing after his 2020 rape conviction in New York was thrown out in April.Weinstein has remained in jail because he was convicted of another rape in Los Angeles in 2022, for which he was sentenced to 16 years in prison.Weinstein's health a 'train wreck'Weinstein was previously taken to hospital in July after testing positive for COVID-19 and contracting pneumonia in both of his lungs.He had earlier had a 10-day stay at Bellevue Hospital, when his lawyer Arthur Aidala said he had ""a lot of problems"" and was ""somewhat of a train wreck health-wise"".Weinstein has been in prison since his 2020 conviction led to him being handed a 23-year prison sentence. The landmark case kickstarted the global #MeToo movement.However, judges ruled the original hearing had been prejudiced by ""egregious"" improper rulings, including a decision to let women testify about allegations that were not part of the case, violating Weinstein's right to a fair trial.Read more entertainment news:Selena Gomez says giving birth could risk her lifeX Factor finalist dies aged 42Hollyoaks star diagnosed with breast cancerBe the first to get Breaking NewsInstall the Sky News app for freeKeep up with all the latest news from the UK and around the world by following Sky NewsUK charges droppedWeinstein has denied raping or sexually assaulting anyone and is also appealing against his Los Angeles conviction.Last week, prosecutors disclosed that they have begun taking steps to potentially charge him with up to three additional sex assaults.They said they have started presenting evidence to a grand jury of up to three previously uncharged allegations against Weinstein - two sexual assaults in the mid-2000s and another sexual assault in 2016.Meanwhile, British prosecutors said last week they were dropping two charges of indecent assault that were brought against Weinstein in 2022 because there was ""no longer a realistic prospect of conviction"".",https://news.sky.com/story/harvey-weinstein-in-intensive-care-at-hospital-after-heart-surgery-13212001
09-09-2024,SkyNews,US,"Three key challenges for Kamala Harris: Biden's shadow, Trump's 'comrade' attacks and her interview problem ","Donald Trump and Kamala Harris face intense scrutiny in the remaining two months of the US election campaign.Ever since Ms Harris became the Democratic Party's presumptive nominee with Joe Biden's historic announcement he would not seek re-election, she has enjoyed a rapid ascent in polling.But momentum can swing quickly in an election campaign, and issues persist for both candidates - which could be crucial at their first debate on Tuesday.Read more:Your ultimate guide to the US electionThe challenges facing TrumpA recent survey from the New York Times and Siena College puts the former president one point ahead of the vice president, at 48% to 47% respectively.With only weeks to go until America goes to the polls, here's a look at three key challenges for the Democratic nominee...Be the first to get Breaking NewsInstall the Sky News app for freeRepublicans portray Kamala Harris as a California liberal of the hard left, a ""radical left lunatic"" as Donald Trump would have it.They point to her 'flip-flopping' on key policy areas and insist it exposes an extreme left agenda, while raising questions of authenticity and trust.In her effort to win the Democratic nomination in 2020, Harris took a left-leaning stance on several issues as she paid heed to her party's progressive wing. That has changed with her political elevation.As vice president, she duly aligned herself more centrally with the administration of the day and so modified her position on issues.On fracking - she favoured a ban, now doesn't; for healthcare, she backed a scheme to eliminate private insurance, now doesn't; on illegal border crossings, she supported decriminalisation, and now doesn't.In a recent interview, Harris addressed her shift by saying her values hadn't changed and her time as VP had given her a fresh perspective.Her opponents will insist she has chosen convenience over conviction in a cynical bid to hoodwink independent, moderate voters.There's a reason Joe Biden was struggling in the polls - his age didn't help, of course, but neither did his record.On a matter most important - the economy - he can cite improvement, having delivered on GDP, unemployment and inflation.His difficulty is in the economic indicators more measurable and meaningful to the public - prices at the petrol pumps and in the shops - that have left Americans feeling the pinch and feeling less well off than they were four years ago.Inflation may be falling, but prices are roughly 20% higher than they were during the COVID pandemic. As hard as the president has tried to sell ""Bidenomics,"" the voters aren't buying.Please use Chrome browser for a more accessible video playerIn her effort to escape the shadow of economic angst, Harris has unveiled proposals she says will cut costs and is punting a populist line that casts big business and greedy landlords as the villains making life difficult.Departing from Biden's big picture boasting about economic wins and legislative victories, she aims to talk money in terms the voter understands and to empathise with their concerns.The strategy needs to work for her. A CNBC survey in August found 40% of voters said they'd be better off financially under a Trump presidency compared to 21% if Harris won.Harris's opponents say that, as a core member of the existing government, she bears responsibility for the public's financial woes.They insist she will also have to answer for the record of the Biden administration as a whole - expect her to face awkward questions, too, on subjects like Afghanistan and the Israel/Hamas conflict.Read more:Will Starmer meet with Harris and Trump?Five things we learnt in Harris's DNC speechKeep up with all the latest news from the UK and around the world by following Sky NewsKamala Harris can work a crowd.At the Democratic National Convention and at rallies across the country, she has demonstrated a stage presence and sure-footedness that energises the faithful. She's comfortable among friends.There remain questions about her vulnerability in more challenging surroundings and, in a country where politics is heavy on performance, that matters.A 2021 interview that Harris conducted with NBC's Lester Holt is given an occasional dusting off, which doesn't do her any favours.On being asked about her role in investigating the root causes of immigration, she was asked the seemingly straightforward question about visiting the US southern border and the exchange unfolded thus:Harris: ""We've been to the border.""Holt: ""You've not been to the border?""Harris: ""And I haven't been to Europe.""It's a brief exchange that took place three years ago and Kamala Harris has performed ably in numerous interviews since.However, that particular interview, and its awkwardness, springs to mind after a campaign - so far - of limited exposure.Since Joe Biden stepped down, Harris has only conducted one sit-down TV interview. Even then, it was with running mate Tim Walz by her side.Please use Chrome browser for a more accessible video playerThat's one set-piece - or joint - interview in six weeks.It would be an astonishing lack of independent scrutiny for someone bidding to be a local parish councillor, let alone president of the United States.There remain questions unasked of Kamala Harris and the apparent reluctance to address them creates a sense of vulnerability.The enthusiasm for a change in the ticket has shored up the Democratic vote, no doubt, but Harris needs to extend her reach to the undecideds, independents and Republicans feeling reluctant about Trump.They need to know who she is and what she stands for. Harris has come a distance in the polls but they are starting to look sticky.She needs the extra votes. If the TV interview is a risk, it's one she might have to take - more than once every six weeks.It's one thing rolling out the teleprompted hits to the adoring masses, it's quite another sitting down for independent interrogation.That, perhaps more than elsewhere, is where judgement lies.",https://news.sky.com/story/three-key-challenges-for-kamala-harris-bidens-shadow-trumps-comrade-attacks-and-her-interview-problem-13211760
11-09-2024,SkyNews,Climate,High chance of cooling La Nina weather pattern brings little respite for surging global and ocean heat,"A La Nina cooling weather phenomenon is likely to kick in at the end of the year, say weather experts, but will do little to dent soaring global and ocean temperatures.La Nina and El Nino are natural changes to temperatures in parts of the Pacific Ocean, and are the biggest fluctuations in the Earth's climate system, with far-reaching impacts on people and extreme weather.The United Nations's World Meteorological Organization (WMO) said on Wednesday there is now a 60% chance the current neutral conditions will give way to La Nina between October and February next year.It follows a prolonged streak of its opposite, the warming El Nino weather pattern, that fuelled 12 months of record-breaking heat before it waned in early summer.But both are now layered over increased global heat due to climate change.That means the cooler La Nina will not dent long term rising global temperatures, nor soaring ocean heat that has been alarming scientists.UK weather: Autumn chill likely to hit in coming daysThundery rain could bring flooding and power cuts to parts of UK as yellow weather warning in placeWorld on track for hottest year ever, scientist warnWMO secretary general Celeste Saulo said: ""Since June 2023, we have seen an extended streak of exceptional global land and sea surface temperature.""Even if a short-term cooling La Nina event does emerge, it will not change the long-term trajectory of rising global temperatures due to heat-trapping greenhouse gases in the atmosphere.""Please use Chrome browser for a more accessible video playerProfessor Richard Allan, from Reading University, said: ""La Nina will temporarily put the brakes on the surge in global ocean surface warming, yet rising greenhouse gases and cleaner air will continue to cause more heat to flood into the deeper ocean.""La Nina is characterised by unusually cold ocean surface temperatures in the equatorial Pacific region, and brings cooler conditions on average.Its impacts depend on when and for how long it strikes, but can include drought in the southern US, drought and flooding in different parts of South America, wet conditions in South Asia, and flooding in Canada.It tends to suppress hurricanes in the central and eastern Pacific basins, but can cause a surge of hurricanes in the Atlantic basin.Both La Nina and El Nino tend to last between nine and 12 months, but can be much longer, and they don't necessarily alternate.Be the first to get Breaking NewsInstall the Sky News app for freeBut 2024 could still be hottest year everBut even with a possible cooling effect from La Nina, 2024 is still likely to be at least as hot as the record-breaking 2023, if not the hottest ever, scientists expect.The European Union's climate service Copernicus has said it is ""pretty certain"" that this year will end up hottest on record.""In order for 2024 not to become the warmest on record, we need to see very significant landscape cooling for the remaining few months, which doesn't look likely at this stage,"" its director Carlo Buontempo said on Friday.Professor Allan told Sky News it is ""almost certain that 2024 will be about as hot on average globally as 2023, even if La Nina kicks in"".But that will be hard to prove because of the margin of error in data readings, he added.Keep up with all the latest news from the UK and around the world by following Sky NewsHow will La Nina affect UK weather?Professor Allan said the UK is less likely to feel the impacts of La Nina on its weather than via economic shocks on the price of food and other resources.He told Sky News: ""UK weather will be minimally affected by La Nina, but we will mostly feel the economic effects of remote floods, droughts and heatwaves as wind patterns are shifted out of kilter, while the severity of these extremes are intensified by ongoing human caused climate change.""Dr Christopher England, Sky News meteorologist, said: ""We probably can't expect much of an effect over the UK until next summer, but it's likely to be cooler and wetter than average then.""The greater risk of Atlantic tropical storms or hurricanes ""may make for a windier later summer and autumn in particular next year"", he said, adding: ""In fact, the summer we've just had is the sort of thing that's more likely in an El Nina year.""",https://news.sky.com/story/high-chance-of-cooling-la-nina-weather-pattern-brings-little-respite-for-surging-global-and-ocean-heat-13212809
06-09-2024,SkyNews,Climate,"World on track for hottest year ever, scientist warn","This year will likely be the warmest on record globally, scientists have warned.The prediction comes after the European Union's climate monitoring service (Copernicus) recorded the hottest summer since measurements began.Despite the UK experiencing its coolest summer since 2015, temperatures were above average across much of Europe, according to Copernicus.Temperatures hit the low 40s in parts of southern Europe earlier this summer, sparking rare red weather alerts, droughts and wildfire warnings in parts of Greece and Italy.Records were set just last year with a temporary boost from an El Nino dialling up temperatures and extreme weather.But the northern meteorological summer - June, July, and August - averaged 16.8C this year, according to the Copernicus Climate Change Service.Please use Chrome browser for a more accessible video playerThat is 0.03C warmer than the old record in 2023.In addition, the global average temperature for the past 12 months (September 2023 to August 2024) has been 0.7C above the 1991-2020 average - the highest on record for any 12-month period.Outside of Europe, temperatures were also above average over eastern Antarctica, Texas, Mexico, Canada, northeast Africa, Iran, China, Japan, and Australia.Keep up with all the latest news from the UK and around the world by following Sky NewsRead more:World breaches critical 1.5CEl Nino: What is it?Samantha Burgess, deputy director of Copernicus, said: ""During the past three months of 2024, the globe has experienced the hottest June and August, the hottest day on record, and the hottest boreal summer on record.""This string of record temperatures is increasing the likelihood of 2024 being the hottest year on record.""The temperature-related extreme events witnessed this summer will only become more intense, with more devastating consequences for people and the planet unless we take urgent action to reduce greenhouse gas emissions.""Be the first to get Breaking NewsInstall the Sky News app for freeCopernicus records go back to 1940, which the scientists cross-checked with other data to confirm this summer was the hottest since the 1850 pre-industrial period.",https://news.sky.com/story/world-on-track-for-hottest-year-ever-scientist-warn-13210450
